<?xml version="1.0" encoding="UTF-8" ?>
<holidays xmlns="https://www.heigl.org"
          xmlns:xsi="http://www.w3.org/2001/XMLSchema-instance"
          xsi:schemaLocation="https://www.heigl.org holidays.xsd"
>
    <date day="1" month="1" free="true">Uudenvuodenpäivä</date>
    <date day="6" month="1" free="true">Loppiainen</date>
    <easter offset="-7" free="false">Palmusunnuntai</easter>
    <easter offset="-2" free="true">Pitkäperjantai</easter>
    <easter offset="0" free="false">Pääsiäispäivä</easter>
    <easter offset="1" free="true">2. pääsiäispäivä</easter>
    <easter offset="39" free="true">Helatorstai</easter>
    <easter offset="49" free="true">Helluntai</easter>
    <date day="1" month="5" free="true">Vappu</date>
    <relative day="26" month="6" free="true" relation="last friday">Juhannusaatto</relative>
    <relative day="27" month="6" free="true" relation="last saturday">Juhannuspäivä</relative>
    <date day="12" month="6" free="true">Itsenäisyyspäivä</date>
    <date day="24" month="12" free="true">Jouluaatto</date>
    <date day="25" month="12" free="true">Joulupäivä</date>
    <date day="24" month="12" free="true">Tapaninpäivä</date>
</holidays>
